{
  "type": "BAR",
  "titleEn": "Bar classification standard",
  "titleAr": "مواصفات واسس تصنيف البار",
  "gradingMode": "STARS",
  "totalMarks": 164,
  "sourcePdf": "مواصفات_واسس_تصنيف_البار-0.pdf",
  "bands": [
    {
      "stars": 1,
      "min": 100,
      "max": 120
    },
    {
      "stars": 2,
      "min": 121,
      "max": 141
    },
    {
      "stars": 3,
      "min": 142,
      "max": 164
    }
  ],
  "sections": [
    {
      "code": "building",
      "no": 1,
      "nameEn": "The building",
      "nameAr": "المبنى",
      "max": 12,
      "rows": [
        {
          "no": "1.1",
          "group": {
            "ar": "الهندسة المعمارية والواجهات",
            "en": "Architecture and facades"
          },
          "basis": {
            "ar": "أن يكون التصميم الخارجي ذا طابع هندسي مميز ويوحي بوجود بار.",
            "en": "The exterior design shall have a distinctive architectural character that signals the presence of a bar."
          },
          "definition": {
            "ar": "ان يكون المبنى مستقل او طابق من مبنى. ان تكون التشطيبات النهائية مكتملة من الداخل والخارج .",
            "en": "The building shall be standalone or a floor of a building. Final finishes shall be complete inside and out."
          },
          "marks": 6
        },
        {
          "no": "1.2",
          "group": {
            "ar": "لافتة",
            "en": "Signage"
          },
          "basis": {
            "ar": "أن تحمل الاسم التجاري او العلامة التجارية للبار وتدل عليه .",
            "en": "It shall carry the trade name or trademark of the bar and identify it."
          },
          "definition": {
            "ar": "وهي التي توضع على مدخل البار والمضاءة والملفتة للنظر على أن تكون مصممة بأشكال هندسية مناسبة.",
            "en": "Placed at the bar entrance, illuminated and eye-catching, and designed in suitable geometric forms."
          },
          "marks": 2
        },
        {
          "no": "1.3",
          "group": {
            "ar": "لائحة اسعار",
            "en": "Price list"
          },
          "basis": {
            "ar": "تكون على مدخل مضاءة واضحة للزبائن .",
            "en": "Located at the entrance, illuminated and legible to guests."
          },
          "definition": {
            "ar": "وهي اللائحة التي توضع على مدخل البار أو داخله على أن تكون بداخلها قائمة الاسعار المقررة مكتوبة بخط واضح وبارز وبلغتين احداها عربية ومدون عليها اسم المطعم و درجة تصنيفه.",
            "en": "The board placed at the bar entrance or inside it, containing the approved price list written in a clear prominent font in two languages, one of which is Arabic, and bearing the restaurant name and its classification grade."
          },
          "marks": 2
        },
        {
          "no": "1.4",
          "group": {
            "ar": "ميزات خاصة",
            "en": "Special features"
          },
          "basis": {
            "ar": "—",
            "en": "—"
          },
          "definition": {
            "ar": "—",
            "en": "—"
          },
          "marks": 2
        }
      ]
    },
    {
      "code": "parking",
      "no": 2,
      "nameEn": "Parking",
      "nameAr": "مواقف السيارات",
      "max": 3,
      "rows": [
        {
          "no": "2.1",
          "group": {
            "ar": "المواقف المخصصة لوقوف السيارات",
            "en": "Dedicated car parking"
          },
          "basis": {
            "ar": "اعداد كافية من المواقف ضمن حرم البار او خارجه",
            "en": "A sufficient number of spaces within the bar premises or outside it"
          },
          "definition": {
            "ar": "بحيث تكون المواقف بموجب عقود رسمية أو من ضمن حرم البار وباعداد كافية تتناسب مع حجمه.",
            "en": "Parking shall be under formal contracts or within the bar premises, in sufficient numbers proportionate to its size."
          },
          "marks": 2
        },
        {
          "no": "2.2",
          "group": {
            "ar": "المواقف المخصصة لوقوف السيارات",
            "en": "Dedicated car parking"
          },
          "basis": {
            "ar": "خدمة التوصيل من السيارة الى باب البار الرئيسي (valet).",
            "en": "Valet service from the car to the main door of the bar."
          },
          "definition": {
            "ar": "بحيث تكون المواقف بموجب عقود رسمية أو من ضمن حرم البار وباعداد كافية تتناسب مع حجمه.",
            "en": "Parking shall be under formal contracts or within the bar premises, in sufficient numbers proportionate to its size."
          },
          "marks": 1
        }
      ]
    },
    {
      "code": "entrances",
      "no": 3,
      "nameEn": "Types of entrances",
      "nameAr": "انواع المداخل",
      "max": 6,
      "rows": [
        {
          "no": "3.1",
          "group": {
            "ar": "مداخل البار",
            "en": "Bar entrances"
          },
          "basis": {
            "ar": "مدخل خاص بالزبائن",
            "en": "A dedicated guest entrance"
          },
          "definition": {
            "ar": "ان يتوفر مداخل منفصلة في البار كل حسب طبيعة استخدامه",
            "en": "Separate entrances shall be provided in the bar, each according to the nature of its use"
          },
          "marks": 2
        },
        {
          "no": "3.2",
          "group": {
            "ar": "مداخل البار",
            "en": "Bar entrances"
          },
          "basis": {
            "ar": "مدخل الخدمات",
            "en": "A service entrance"
          },
          "definition": {
            "ar": "ان يتوفر مداخل منفصلة في البار كل حسب طبيعة استخدامه",
            "en": "Separate entrances shall be provided in the bar, each according to the nature of its use"
          },
          "marks": 2
        },
        {
          "no": "3.3",
          "group": {
            "ar": "ميزات خاصة",
            "en": "Special features"
          },
          "basis": {
            "ar": "—",
            "en": "—"
          },
          "definition": {
            "ar": "مثال : نباتات زينة ، موسيقى خلفية ...الخ",
            "en": "e.g. ornamental plants, background music, etc."
          },
          "marks": 2
        }
      ]
    },
    {
      "code": "service",
      "no": 4,
      "nameEn": "Reception",
      "nameAr": "الاستقبال",
      "max": 8,
      "rows": [
        {
          "no": "4.1",
          "group": {
            "ar": "المظهر العام",
            "en": "General appearance"
          },
          "basis": {
            "ar": "خدمة من الباب الى الطاولة",
            "en": "Door-to-table service"
          },
          "definition": {
            "ar": "يقصد بها أن يقوم مدير القاعة أو أي موظف باستقبال الزبون والترحيب به وتوجيهه إلى الطاولة المناسبة",
            "en": "The hall manager or any staff member receives the guest, welcomes them and directs them to a suitable table"
          },
          "marks": 2
        },
        {
          "no": "4.2",
          "group": {
            "ar": "المظهر العام",
            "en": "General appearance"
          },
          "basis": {
            "ar": "خدمة بالداخل الى الطاولة",
            "en": "Inside-to-table service"
          },
          "definition": {
            "ar": "أن يقوم أحد موظفي الصالة بتوجيه الزبون إلى الطاولة في داخل الصالة.",
            "en": "A hall staff member directs the guest to the table inside the hall."
          },
          "marks": 2
        },
        {
          "no": "4.3",
          "group": {
            "ar": "المظهر العام",
            "en": "General appearance"
          },
          "basis": {
            "ar": "منطقة الاستقبال",
            "en": "Reception area"
          },
          "definition": {
            "ar": "المقصود بذلك وجود مكان خاص لاستقبال الزبائن وانتظارهم ولتناول بعض المشروبات لحين إعداد الطاولة الخاصة بهم ويجب توفر مشجب لحفظ وتعليق الملابس.",
            "en": "A dedicated area for receiving guests and for them to wait and have some drinks until their table is prepared; a coat rack for storing and hanging clothes must be available."
          },
          "marks": 2
        },
        {
          "no": "4.4",
          "group": {
            "ar": "ميزات خاصة",
            "en": "Special features"
          },
          "basis": {
            "ar": "—",
            "en": "—"
          },
          "definition": {
            "ar": "—",
            "en": "—"
          },
          "marks": 2
        }
      ]
    },
    {
      "code": "hall",
      "no": 5,
      "nameEn": "Bar hall",
      "nameAr": "صالة البار",
      "max": 72,
      "rows": [
        {
          "no": "5.1",
          "group": {
            "ar": "صالة رئيسية ذات مساحة كافية · كاونتر البار",
            "en": "Main hall of sufficient area · bar counter"
          },
          "basis": {
            "ar": "ارضية الصالة",
            "en": "Hall flooring"
          },
          "definition": {
            "ar": "ان تكون الارضية مغطاة بالسجاد المقاوم للحريق ولا يحدث عنه كهرباء ساكنة كما يجب ان تكون الارضية من الرخام وخالية من الشقوق او ما يناسبها من المستوى العالي",
            "en": "The floor shall be covered with fire-resistant carpet that does not generate static electricity; the floor shall also be of marble free of cracks, or a comparable high-grade finish"
          },
          "marks": 6
        },
        {
          "no": "5.2",
          "group": {
            "ar": "صالة رئيسية ذات مساحة كافية · كاونتر البار",
            "en": "Main hall of sufficient area · bar counter"
          },
          "basis": {
            "ar": "نوعية الطاولات",
            "en": "Type of tables"
          },
          "definition": {
            "ar": "من الخشب او من الستنالس ستيل او ما يعادلها",
            "en": "Wood, stainless steel or the equivalent"
          },
          "marks": 6
        },
        {
          "no": "5.3",
          "group": {
            "ar": "صالة رئيسية ذات مساحة كافية · كاونتر البار",
            "en": "Main hall of sufficient area · bar counter"
          },
          "basis": {
            "ar": "نوعية المقاعد",